<?xml version="1.0" encoding="UTF-8"?>
<Luminaire xmlns:xsi="http://www.w3.org/2001/XMLSchema-instance" xsi:noNamespaceSchemaLocation="https://gldf.io/xsd/l3d/0.11.0/l3d.xsd">
    <Header>
        <CreatedWithApplication>Example-Tool</CreatedWithApplication>
        <CreationTimeCode>2021-03-03T10:10:10</CreationTimeCode>
        <FormatVersion major="0" minor="11" />
    </Header>
    <GeometryDefinitions>
        <GeometryFileDefinition id="cube" filename="cube.obj" units="m" />
    </GeometryDefinitions>
    <Structure>
        <Geometry partName="luminaire" includedInMeasurement="true">
            <Position x="0" y="0" z="0" />
            <Rotation x="0" y="0" z="0" />
            <GeometryReference geometryId="cube" />
            <LightEmittingObjects>
                <LightEmittingObject partName="leo">
                    <Position x="0" y="0" z="0" />
                    <Rotation x="0" y="0" z="0" />
                    <Rectangle sizeX="0.5" sizeY="0.25" />
                </LightEmittingObject>
            </LightEmittingObjects>
            <LightEmittingSurfaces>
                <LightEmittingSurface partName="les">
                    <LightEmittingObjectReference lightEmittingPartName="leo" />
                    <FaceAssignments>
                        <FaceAssignment faceIndex="3" />
                    </FaceAssignments>
                </LightEmittingSurface>
            </LightEmittingSurfaces>
        </Geometry>
    </Structure>
</Luminaire>