<?xml version="1.0" encoding="UTF-8"?>
<Luminaire xmlns:xsi="http://www.w3.org/2001/XMLSchema-instance" xsi:noNamespaceSchemaLocation="https://gldf.io/xsd/l3d/0.11.0/l3d.xsd">
    <Header>
        <CreatedWithApplication>Keyboard-v1.0</CreatedWithApplication>
        <CreationTimeCode>2020-12-11T11:12:13</CreationTimeCode>
        <FormatVersion major="0" minor="11" />
    </Header>
    <GeometryDefinitions>
        <GeometryFileDefinition id="luminaire" filename="luminaire.obj" units="mm" />
    </GeometryDefinitions>
    <Structure>
        <Geometry partName="luminaire">
            <Position x="0" y="0" z="-0.5" />
            <Rotation x="0" y="0" z="0" />
            <GeometryReference geometryId="luminaire" />
            <LightEmittingObjects>
                <LightEmittingObject partName="leo_top">
                    <Position x="0" y="0" z="0.0375" />
                    <Rotation x="180" y="0" z="90" />
                    <Rectangle sizeX="0.15" sizeY="1" />
                </LightEmittingObject>
                <LightEmittingObject partName="leo_bottom">
                    <Position x="0" y="0" z="0.0025" />
                    <Rotation x="0" y="0" z="-90" />
                    <Rectangle sizeX="0.17" sizeY="1.175" />
                </LightEmittingObject>
            </LightEmittingObjects>
            <LightEmittingSurfaces>
                <LightEmittingSurface partName="les_bottom">
                    <LightEmittingObjectReference lightEmittingPartName="leo_bottom" />
                    <FaceAssignments>
                        <FaceAssignment faceIndex="90" />
                        <FaceAssignment faceIndex="91" />
                    </FaceAssignments>
                </LightEmittingSurface>
                <LightEmittingSurface partName="les_top">
                    <LightEmittingObjectReference lightEmittingPartName="leo_top" />
                    <FaceAssignments>
                        <FaceAssignment faceIndex="84" />
                        <FaceAssignment faceIndex="85" />
                    </FaceAssignments>
                </LightEmittingSurface>
            </LightEmittingSurfaces>
            <ElectricalConnectors>
                <ElectricalConnector x="-0.575" y="0" z="0.04" />
            </ElectricalConnectors>
            <PendulumConnectors>
                <PendulumConnector x="-0.55" y="0" z="0.04" />
                <PendulumConnector x="0.55" y="0" z="0.04" />
            </PendulumConnectors>
        </Geometry>
    </Structure>
</Luminaire>