<?xml version="1.0" encoding="UTF-8"?>
<Luminaire xmlns:xsi="http://www.w3.org/2001/XMLSchema-instance" xsi:noNamespaceSchemaLocation="https://raw.githubusercontent.com/globallightingdata/l3d/develop/xsd/l3d.xsd">
	<Header>
		<CreatedWithApplication>Example-Tool</CreatedWithApplication>
		<CreationTimeCode>2021-03-03T10:10:10</CreationTimeCode>
	</Header>
	<GeometryDefinitions>
		<GeometryFileDefinition id="cube" filename="cube.obj" units="m" />
	</GeometryDefinitions>
	<Structure>
		<Geometry partName="luminaire">
			<Position x="-0.25" y="-0.125" z="0.05" />
			<Rotation x="0" y="0" z="0" />
			<GeometryReference geometryId="cube" />
			<LightEmittingObjects>
				<LightEmittingObject partName="leo">
					<Position x="0.25" y="0.125" z="-0.05" />
					<Rotation x="0" y="0" z="0" />
					<Rectangle sizeX="0.5" sizeY="0.25" />
				</LightEmittingObject>
			</LightEmittingObjects>
			<LightEmittingFaceAssignments>
				<Assignment faceIndex="3" lightEmittingPartName="leo" />
			</LightEmittingFaceAssignments>
		</Geometry>
	</Structure>
</Luminaire>